{
  "snapshot_id": "febca2b3ca678707b5898ea5fcea49b101e24f8cc119bc7ae16806219672f684",
  "contract_code": "research-quality-envelope",
  "contract_version": "v1",
  "envelope_kind": "QUALITY",
  "identity": {
    "analysis_unit_id": "item:43",
    "scope_kind": "ITEM",
    "display_name": "M9 Bayonet Doppler P2 FN",
    "identity_available_at": "2026-08-22T03:55:00.000000Z",
    "catalog_version": "catalog-v2",
    "analysis_unit_kind": "STYLE_VARIANT",
    "edition_kind": "STANDARD",
    "parent_analysis_unit_id": "item:42"
  },
  "as_of": "2026-08-22T04:00:00.000000Z",
  "available_at": "2026-08-22T03:59:59.000000Z",
  "policy_version": "source-quality-v1",
  "input_quality_snapshot_id": "source_quality_demo000000000000000001",
  "expected_cell_count": 4,
  "observed_cell_count": 3,
  "fresh_cell_count": 2,
  "coverage_ratio": "0.75",
  "fresh_coverage_ratio": "0.5",
  "missing_cell_count": 1,
  "stale_cell_count": 1,
  "future_fact_count": 0,
  "source_summaries": [
    {
      "source_ref": "source:backup",
      "expected_feature_count": 2,
      "observed_feature_count": 1,
      "fresh_feature_count": 1,
      "missing_feature_count": 1,
      "stale_feature_count": 0
    },
    {
      "source_ref": "source:primary",
      "expected_feature_count": 2,
      "observed_feature_count": 2,
      "fresh_feature_count": 1,
      "missing_feature_count": 0,
      "stale_feature_count": 1
    }
  ],
  "conflicts": [
    {
      "feature_key": "best_ask",
      "reason_code": "VALUE_DISPERSION",
      "participating_source_refs": ["source:backup", "source:primary"],
      "source_fact_count": 2,
      "relative_dispersion": "0.2"
    }
  ],
  "query_observations": [
    {
      "observation_id": "bbbbbbbbbbbbbbbbbbbbbbbbbbbbbbbbbbbbbbbbbbbbbbbbbbbbbbbbbbbbbbbb",
      "source_ref": "source:primary",
      "query_kind": "STYLE_LISTING",
      "sample_state": "ZERO_CURRENT_SAMPLE",
      "capability_state": "UNKNOWN",
      "returned_member_count": 0,
      "observed_at": "2026-08-22T03:59:56.000000Z",
      "available_at": "2026-08-22T03:59:57.000000Z"
    },
    {
      "observation_id": "cccccccccccccccccccccccccccccccccccccccccccccccccccccccccccccccc",
      "source_ref": "source:primary",
      "query_kind": "STYLE_LISTING",
      "sample_state": "POSITIVE_SAMPLE",
      "capability_state": "CONFIRMED",
      "returned_member_count": 2,
      "observed_at": "2026-08-22T03:59:56.000000Z",
      "available_at": "2026-08-22T03:59:57.000000Z"
    }
  ]
}
